{
  "schema_version": "2",
  "command": "config get",
  "generated_at": "2026-01-02T03:04:05.000Z",
  "status": "ok",
  "data": {
    "key": null,
    "value": {
      "schema_version": 1,
      "sources": [
        {
          "alias": "work",
          "installation_id": "fabf2065-74f1-452a-908c-3b56e25080e5",
          "adapter": "opencode",
          "database": "{{root}}/opencode.db",
          "provider": "anthropic",
          "profile": "default",
          "plan": "pro",
          "plan_profile": "generic",
          "fingerprint": "oc-sqlite-msgpart-v1"
        },
        {
          "alias": "personal",
          "installation_id": "44ab2305-bdf2-4a09-8e6e-a39b5f4d3fdd",
          "adapter": "claude",
          "projects": "{{root}}/claude-home/projects",
          "provider": "anthropic",
          "profile": "default",
          "plan": "pro",
          "plan_profile": "generic",
          "fingerprint": "cc-jsonl-turntree-v1"
        }
      ],
      "analysis": {
        "horizons": [
          "PT1H",
          "PT5H",
          "P1D",
          "P7D"
        ]
      },
      "presentation": {
        "json": false
      },
      "prospective_analysis": {
        "enabled": false
      }
    }
  },
  "warnings": [],
  "errors": []
}
