{
  "schema_version": "2",
  "command": "setup opencode",
  "generated_at": "2026-01-02T03:04:05.000Z",
  "status": "ok",
  "data": {
    "source": {
      "alias": "work",
      "installation_id": "aaa99857-7655-4f9c-a668-7ae82fb8d71b",
      "adapter": "opencode",
      "provider": "anthropic",
      "profile": "default",
      "plan": "pro",
      "plan_profile": "generic"
    },
    "fingerprint": {
      "family": "oc-sqlite-msgpart-v1",
      "supported": true
    },
    "dry_run": {
      "observations": 1
    }
  },
  "warnings": [],
  "errors": []
}
