{
  "schema_version": "2",
  "command": "setup claude",
  "generated_at": "2026-01-02T03:04:05.000Z",
  "status": "ok",
  "data": {
    "source": {
      "alias": "personal",
      "installation_id": "40e203af-2986-4912-887d-2594ddce481c",
      "adapter": "claude",
      "provider": "anthropic",
      "profile": "default",
      "plan": "pro",
      "plan_profile": "generic"
    },
    "fingerprint": {
      "family": "cc-jsonl-turntree-v1",
      "supported": true
    },
    "dry_run": {
      "observations": 1
    }
  },
  "warnings": [],
  "errors": []
}
