{
  "schema_version": "2",
  "command": "setup opencode",
  "generated_at": "2026-01-02T03:04:05.000Z",
  "status": "ok",
  "data": {
    "source": {
      "alias": "work",
      "installation_id": "1d10fb70-5aee-403b-a6fc-c4333a91722c",
      "adapter": "opencode",
      "provider": "anthropic",
      "profile": "default",
      "plan": "pro",
      "plan_profile": "generic"
    },
    "fingerprint": {
      "family": "oc-sqlite-msgpart-v1",
      "supported": true
    },
    "dry_run": {
      "observations": 1,
      "applied": true
    }
  },
  "warnings": [],
  "errors": []
}
